Categoria_CID;RO;AC;AM;RR;PA;AP;TO;MA;PI;CE;RN;PB;PE;AL;SE;BA;MG;ES;RJ;SP;PR;SC;RS;MS;MT;GO;DF;Total
N27   Hipoplasia renal de causa desconhecida;-;-;-;-;-;-;-;-;-;-;-;-;-;-;-;-;-;-;-;1;-;-;-;-;-;-;-;1
N28   Outr transt do rim e do ureter NCOP;-;-;-;-;-;-;-;-;1;1;-;-;-;-;-;1;-;-;-;2;-;-;-;-;-;1;-;6
N30   Cistite;-;-;-;-;-;-;-;-;-;-;1;-;-;-;-;-;-;-;-;1;-;-;-;-;-;-;-;2
N39   Outr transt do trato urinario;-;-;1;-;-;-;-;1;1;-;2;2;3;4;1;5;-;2;5;4;-;1;2;-;1;2;-;37
N49   Transt inflam orgaos genitais masc NCOP;-;-;-;-;-;-;-;-;-;-;-;-;-;-;-;-;-;-;1;-;-;-;-;-;-;-;-;1
P00   Fet rec-nasc afet afec mat n obr rel grav at;18;4;84;6;101;17;45;94;66;63;35;26;189;20;49;111;153;49;215;447;235;63;96;27;66;74;62;2415
P01   Fet rec-nasc afet complic maternas gravidez;5;2;42;4;45;17;27;36;63;65;11;17;101;8;29;94;88;29;100;395;161;40;85;19;34;76;48;1641
P02   Fet rec-nasc afet compl plac cord umb membr;4;4;37;5;63;13;16;96;36;47;27;21;79;13;21;95;113;33;124;248;104;56;83;14;20;64;36;1472
P03   Fet rec-nasc afet out compl trab parto parto;-;-;21;-;25;1;2;17;9;10;9;12;20;2;7;42;33;14;19;170;33;17;13;9;3;14;1;503
P04   Fet rec-nasc infl af noc trans plac leit mat;-;-;-;-;3;-;1;2;5;1;1;-;5;-;-;3;4;1;1;11;6;2;5;1;3;1;-;56
P05   Crescimento fetal retard e desnutric fetal;-;1;4;-;8;-;-;13;3;12;1;3;5;3;-;13;16;-;7;14;7;3;4;1;2;-;-;120
P07   Transt rel gest curt dur peso baix nasc NCOP;16;10;21;1;150;19;-;125;22;124;32;40;78;15;32;222;161;26;74;184;43;38;67;14;38;23;12;1587
P08   Transt relac gest prolong peso elevado nasc;-;-;1;-;-;-;-;1;-;-;-;-;-;-;-;-;-;-;-;-;-;-;-;-;-;-;-;2
P10   Laceracao intracran hemorrag dev traum parto;-;-;1;-;-;-;-;-;-;-;-;-;-;-;-;1;-;-;1;2;-;1;-;-;-;-;-;6
P11   Outr traum de parto do sist nervoso central;-;-;-;-;1;-;-;2;-;-;-;-;1;-;-;-;-;2;-;1;-;-;-;-;-;-;-;7
P12   Lesao do couro cabeludo dev traum de parto;-;-;-;-;-;-;-;1;-;-;-;-;-;-;-;-;-;-;-;-;-;-;-;-;-;-;-;1
P13   Lesoes do esqueleto dev traum de parto;-;-;-;-;1;-;-;-;-;-;-;-;-;1;-;-;-;-;-;-;-;-;-;-;1;-;-;3
P15   Outr traum de parto;-;-;2;-;5;-;-;-;-;8;-;2;1;2;2;2;5;-;1;8;1;1;1;2;2;2;-;47
P20   Hipoxia intra-uterina;1;3;29;1;42;1;4;46;14;19;4;33;25;8;4;89;59;4;66;64;9;11;11;5;8;15;5;580
P21   Asfixia ao nascer;13;8;11;6;87;19;6;54;15;74;11;15;44;17;26;104;51;30;88;180;20;23;38;17;10;9;10;986
P22   Desconforto respirat do recem-nascido;17;17;103;18;168;12;17;115;28;121;44;85;63;91;32;234;249;25;193;406;92;45;94;26;34;76;14;2419
P23   Pneumonia congen;-;1;14;1;29;2;1;8;3;12;7;12;9;10;10;9;19;6;12;55;5;8;14;2;11;8;3;271
P24   Sindr de aspiracao neonatal;10;9;46;8;74;4;6;77;29;46;10;20;43;17;7;99;59;13;46;102;36;27;30;22;13;31;7;891
P25   Enfisema interst afecc corr orig per perinat;-;1;3;-;5;2;1;7;-;8;3;3;3;3;2;7;14;1;8;37;4;3;3;6;2;6;2;134
P26   Hemorragia pulmonar orig periodo perinatal;2;4;3;3;40;3;3;13;11;22;9;15;13;11;7;47;25;1;17;101;21;19;20;4;8;20;13;455
P27   Doenc respirat cron orig periodo perinatal;-;-;3;3;4;3;1;5;5;9;4;7;7;2;1;8;11;2;21;35;8;10;8;-;1;3;2;163
P28   Outr afeccoes respirat orig per perinatal;8;9;34;2;69;7;3;50;14;44;15;6;20;15;4;160;80;3;31;144;19;16;22;10;7;31;5;828
P29   Transt cardiovasc orig periodo perinatal;8;5;15;8;46;4;3;39;24;25;8;14;17;5;5;72;71;9;61;108;19;30;20;20;14;14;3;667
P35   Doenc virais congen;-;-;1;-;2;1;-;2;-;-;-;1;2;-;1;-;1;3;-;5;2;-;1;-;-;1;-;23
P36   Septicemia bacter do recem-nascido;43;25;93;6;193;33;11;197;26;151;68;91;105;112;72;255;243;57;254;606;64;82;86;25;64;85;22;3069
P37   Outr doenc infecc e parasit congen;-;-;2;-;3;-;4;3;-;2;-;-;1;2;1;2;12;2;7;14;6;2;5;1;2;3;-;74
P38   Onfalite recem-nasc c/ou s/hemorragia leve;-;-;7;-;3;-;-;3;2;3;-;-;2;1;-;3;2;-;4;3;2;-;1;-;1;1;1;39
P39   Outr infecc especificas do periodo perinatal;1;1;5;2;45;9;1;17;15;44;2;14;15;7;4;55;17;1;16;57;6;9;9;5;10;18;1;386
P50   Perda sanguinea fetal;-;-;-;1;1;-;-;-;-;2;-;1;1;-;-;1;4;-;1;4;-;-;2;-;-;-;-;18
P51   Hemorragia umbilical do recem-nascido;-;-;-;-;1;-;-;2;-;1;-;-;-;-;-;-;-;-;-;-;-;-;-;-;1;-;-;5
P52   Hemorragia intracran nao-traum feto rec-nasc;-;-;2;-;3;-;-;2;-;2;3;2;2;1;1;9;11;-;5;31;4;11;4;-;1;3;3;100
P53   Doenc hemorragica do feto e do recem-nascido;-;-;-;1;1;-;-;2;1;2;-;-;3;-;1;4;4;-;1;7;-;1;1;3;-;-;1;33
P54   Outr hemorragias neonatais;2;-;1;-;3;2;-;14;1;1;1;-;1;-;-;5;5;-;3;14;3;1;2;-;-;1;-;60
P55   Doenc hemolitica do feto e do recem-nascido;-;-;1;-;-;1;1;3;-;-;-;1;4;2;-;6;1;1;2;7;2;2;1;-;1;2;1;39
P56   Hidropsia fetal dev doenc hemolitica;-;-;1;1;1;-;-;2;-;2;-;-;-;1;-;2;-;-;1;2;1;1;-;-;1;-;-;16
P57   Kernicterus;-;-;-;-;9;-;1;6;-;1;-;-;1;-;1;4;2;-;1;-;-;1;-;-;1;-;-;28
P58   Ictericia neonatal dev outr hemolises excess;-;2;2;-;1;1;-;-;-;1;-;-;1;-;-;5;-;1;-;-;-;-;1;-;-;-;-;15
P59   Ictericia neonatal dev outr causas e as NE;-;-;4;-;12;1;-;4;2;3;-;-;-;2;-;2;-;-;-;2;1;1;-;-;-;-;-;34
P60   Coagulacao intravasc dissem feto rec-nasc;1;6;1;-;6;1;3;3;4;3;2;4;1;3;-;9;4;-;4;17;1;1;5;1;2;6;1;89
P61   Outr transt hematologicos perinatais;-;-;-;-;7;1;-;6;-;3;3;1;2;-;1;11;8;3;17;18;1;2;-;-;2;3;1;90
P70   Trans transit metab carboid esp fet rec-nasc;-;-;-;-;1;-;1;2;2;1;1;-;3;1;1;8;4;2;7;14;6;2;6;1;-;6;1;70
P72   Outr transt endocrinos transit period neonat;-;-;-;-;-;-;-;-;-;-;-;-;-;1;-;1;-;-;-;-;-;-;-;-;-;-;-;2
P74   Outr dist eletrolit metab transit per neonat;1;-;1;-;3;-;-;2;1;4;-;-;4;-;-;3;4;1;2;5;1;1;-;-;1;-;-;34
P76   Outr obstrucoes intestinais do recem-nascido;-;-;3;-;1;-;-;2;-;3;1;-;-;1;1;6;1;2;3;1;1;-;3;-;2;2;-;33
P77   Enterocolite necrotizante do feto e rec-nasc;-;1;20;1;20;1;6;25;9;16;12;5;35;8;18;55;74;11;64;145;18;23;38;10;9;21;4;649
P78   Outr transt ap digestivo periodo perinatal;1;-;-;2;2;1;-;1;2;3;5;1;5;2;3;8;19;2;8;19;3;3;3;-;1;-;-;94
P80   Hipotermia do recem-nascido;-;-;-;-;-;-;-;2;-;1;3;-;1;1;3;2;2;-;-;2;1;-;-;-;2;-;-;20
P81   Outr disturbios regulacao termica rec-nasc;1;-;-;1;-;-;-;-;-;-;-;-;1;-;-;7;4;-;-;-;-;-;-;-;1;-;-;15
P83   Outr afecc compr tegum espec feto rec-nasc;3;1;3;1;8;1;1;4;4;6;3;6;10;1;1;15;13;2;12;20;7;-;7;3;4;3;1;140
P90   Convulsoes do recem-nascido;1;-;2;-;3;-;-;1;-;2;2;-;-;-;-;4;1;-;-;5;1;-;1;1;-;2;-;26
P91   Outr disturbios funcao cerebral rec-nasc;1;2;-;-;2;-;-;3;-;-;-;3;-;3;1;6;6;1;1;13;4;2;2;-;1;-;-;51
P92   Problemas de alimentacao do recem-nascido;-;-;1;-;2;-;-;2;2;1;-;-;1;-;-;3;4;-;-;1;-;-;-;-;1;1;-;19
P94   Transt do tonus muscular do recem-nascido;-;-;-;-;1;-;-;1;-;1;-;-;1;-;-;1;-;-;-;2;-;-;-;1;-;-;-;8
P96   Outr afeccoes originadas periodo perinatal;4;5;35;1;34;3;1;21;9;33;10;7;20;5;9;143;110;7;54;175;18;17;19;11;15;32;10;808
Q00   Anencefalia e malformacoes similares;10;5;20;1;28;4;6;33;13;37;16;14;24;9;6;34;32;14;37;81;25;13;17;10;14;14;4;521
Q01   Encefalocele;1;-;1;1;4;-;-;5;5;9;-;4;6;1;1;2;10;1;3;6;3;2;6;2;1;2;1;77
Q02   Microcefalia;2;-;4;1;8;-;-;3;1;5;2;1;5;2;2;6;3;1;4;10;4;-;2;-;6;4;-;76
Q03   Hidrocefalia congen;-;-;13;-;23;2;2;11;5;6;4;7;12;9;2;10;15;1;13;29;6;7;7;8;8;5;3;208
Q04   Outr malformacoes congen do cerebro;3;2;15;3;17;1;5;9;5;8;7;2;17;6;2;19;22;4;22;41;6;5;6;6;6;8;4;251
Q05   Espinha bifida;-;1;5;-;7;-;-;3;2;1;2;3;6;4;-;4;5;1;1;18;5;1;-;3;3;6;-;81
Q06   Outr malformacoes congen da medula espinhal;-;-;-;-;-;-;-;-;-;-;-;-;-;-;-;1;-;-;1;1;-;-;1;-;1;1;-;6
Q07   Outr malformacoes congen do sist nervoso;-;-;-;-;3;-;1;1;1;-;2;-;3;-;1;10;4;-;8;6;3;-;3;2;1;-;-;49
Q18   Outr malformacoes congen da face e pescoco;-;-;-;-;3;-;-;1;1;-;-;-;-;-;-;-;-;-;-;-;-;-;-;-;-;1;-;6
Q20   Malform congen camaras e comunicacoes card;2;2;5;-;9;1;6;9;3;18;2;5;9;6;4;18;27;7;23;89;23;12;21;7;8;14;4;334
Q21   Malformacoes congen dos septos cardiacos;7;-;18;4;25;2;3;5;6;16;10;2;21;5;2;23;31;20;29;97;22;20;36;10;10;14;12;450
Q22   Malform congen valvas pulmonar tricuspide;-;1;1;1;11;2;3;1;2;7;4;-;7;2;1;3;10;1;13;46;11;8;10;2;5;3;3;158
Q23   Malformacoes congen valvas aortica e mitral;1;1;7;-;5;2;3;5;2;9;1;3;10;2;-;3;20;7;14;67;26;22;20;5;4;5;13;257
Q24   Outr malformacoes congen do coracao;28;10;62;17;74;18;18;94;35;81;37;38;91;38;29;129;170;16;112;245;57;38;41;19;44;69;22;1632
Q25   Malformacoes congen das grandes arterias;3;-;7;2;9;2;6;3;2;12;2;3;18;4;6;29;31;6;29;90;11;26;20;9;5;13;14;362
Q26   Malformacoes congen das grandes veias;-;-;1;-;2;-;1;2;-;-;1;1;-;-;-;1;2;4;2;3;2;3;6;1;-;1;1;34
Q27   Outr malformacoes congen sist vasc perif;-;-;-;-;1;-;-;-;-;-;-;1;-;-;-;-;1;1;1;1;1;-;-;-;-;2;1;10
Q28   Outr malform congen aparelho circulatorio;-;-;-;2;13;-;1;-;3;6;-;4;2;-;-;3;1;-;2;3;3;1;3;-;1;-;-;48
Q30   Malformacao congen do nariz;-;-;-;-;1;-;-;-;-;-;-;-;1;-;-;1;-;-;2;1;-;-;-;1;-;-;-;7
Q31   Malformacoes congen da laringe;-;-;1;-;1;1;-;-;1;1;-;-;1;-;-;1;-;-;3;4;2;-;-;-;-;1;1;18
Q32   Malformacoes congen traqueia e bronquios;1;-;1;-;-;-;-;1;1;2;1;-;-;-;1;1;1;-;3;2;1;-;1;-;2;1;1;21
Q33   Malformacoes congen do pulmao;6;3;3;1;15;1;3;8;6;19;10;7;30;7;8;30;41;10;29;133;24;16;10;7;10;19;4;460
Q34   Outr malformacoes congen aparelho respirat;-;-;3;-;2;-;-;-;1;-;1;1;-;-;-;2;3;1;2;2;1;-;2;-;1;-;-;22
Q35   Fenda palatina;-;-;-;-;-;1;-;-;-;-;-;1;1;-;-;2;-;-;1;3;-;1;2;-;-;-;-;12
Q36   Fenda labial;-;-;-;-;-;-;-;-;-;-;-;1;1;1;-;-;-;-;-;-;-;-;1;-;-;-;-;4
Q37   Fenda labial c/fenda palatina;-;1;-;-;3;1;-;-;-;1;-;-;1;-;-;-;-;-;1;1;-;-;2;2;1;-;-;14
Q38   Outr malform congen lingua boca e faringe;-;-;-;-;1;-;-;-;-;1;-;-;-;-;-;-;-;-;-;-;-;-;1;-;-;1;-;4
Q39   Malformacoes congen do esofago;1;-;3;1;7;2;-;4;4;8;3;4;3;5;-;3;14;6;8;27;6;5;6;3;4;8;2;137
Q40   Outr malform congen trato digestivo super;-;-;-;-;1;-;-;-;2;3;-;2;-;3;1;1;3;-;1;1;-;1;-;-;-;-;-;19
Q41   Ausencia atresia estenose congen intest delg;-;-;4;1;3;1;1;2;2;4;1;4;5;2;-;5;3;1;1;9;5;2;4;-;2;2;4;68
Q42   Ausencia atresia e estenose congen do colon;-;-;1;-;3;-;-;1;3;2;-;-;3;-;-;-;1;-;4;3;1;-;2;-;3;1;-;28
Q43   Outr malformacoes congen do intestino;1;1;5;-;5;-;3;3;4;3;-;1;7;-;1;13;6;-;4;13;5;2;4;1;4;3;2;91
Q44   Malform congen vesic biliar via biliar figad;1;-;2;1;3;1;-;5;2;-;1;1;3;-;-;3;5;1;4;11;2;2;1;1;-;2;1;53
Q45   Outr malformacoes congen aparelho digestivo;-;1;1;-;2;-;-;2;-;2;-;-;1;-;-;4;4;-;2;3;4;2;-;-;-;-;-;28
Q53   Testiculo nao-descido;-;-;-;-;-;-;-;-;-;-;-;-;-;-;-;-;-;-;-;-;-;-;1;-;-;-;-;1
Q55   Outr malformacoes congen org genitais masc;-;-;1;-;1;-;-;-;-;-;-;-;-;-;-;-;-;-;-;1;-;-;-;-;-;-;-;3
Q56   Sexo indeterminado e pseudo-hermafroditismo;-;-;-;-;4;-;-;-;-;-;-;-;1;-;-;-;-;-;-;2;-;-;-;-;-;-;-;7
Q60   Agenesia renal e outr defeitos reducao rim;4;-;-;1;1;-;3;3;1;14;2;1;9;2;-;6;14;2;12;27;12;3;9;1;1;11;3;142
Q61   Doenc cisticas do rim;-;-;1;-;1;1;1;1;-;3;2;-;5;-;-;2;9;1;6;39;5;1;5;1;1;2;3;90
Q62   Anom cong obstr pelv renal malf cong ureter;-;-;-;-;-;-;-;2;-;-;-;1;1;-;-;1;3;1;2;10;2;2;1;1;-;1;-;28
Q63   Outr malformacoes congen do rim;-;-;-;-;1;1;-;3;1;1;-;3;-;-;-;1;7;1;3;13;-;2;3;1;-;4;-;45
Q64   Outr malformacoes congen aparelho urinario;-;1;-;-;1;-;-;2;-;1;1;-;5;-;-;4;3;1;4;8;3;1;4;-;2;2;-;43
Q65   Malformacoes congen do quadril;-;-;-;-;-;-;-;-;-;-;-;1;-;-;-;-;-;-;-;-;-;-;-;-;-;-;-;1
Q74   Outr malformacoes congen dos membros;1;-;-;-;-;-;-;-;-;-;-;-;-;-;-;-;-;-;-;-;-;-;-;-;1;-;-;2
Q75   Outr malformacoes congen ossos cranio e face;-;-;-;-;5;-;-;1;1;-;2;-;2;-;1;2;2;2;2;12;2;1;1;-;2;1;-;39
Q76   Malform congen coluna vertebral ossos torax;-;-;1;-;1;-;-;1;-;-;-;-;-;-;-;-;-;-;-;2;-;-;-;-;1;-;-;6
Q77   Osteocondr c/anom cresc ossos long col vert;1;-;4;-;-;-;1;-;1;2;1;-;1;-;2;3;3;2;2;7;9;4;3;2;-;4;1;53
Q78   Outr osteocondrodisplasias;-;-;-;-;1;-;-;2;-;1;-;-;4;-;-;2;3;1;5;4;5;-;1;-;-;2;2;33
Q79   Malformacoes congen sist osteomuscular NCOP;9;2;21;7;40;5;9;20;12;25;10;12;41;7;6;35;44;17;52;112;38;21;41;10;10;14;19;639
Q80   Ictiose congen;-;-;-;-;-;-;-;-;-;-;-;-;-;-;-;-;1;-;-;2;-;-;-;-;-;-;-;3
Q81   Epidermolise bolhosa;-;-;-;-;1;-;-;1;-;1;-;-;-;-;-;-;1;-;-;-;-;-;-;-;-;-;-;4
Q86   Sindr c/malf cong dev causas exog conh NCOP;-;-;-;-;-;-;-;-;-;-;-;-;-;-;-;-;-;-;-;-;-;-;1;-;1;-;-;2
Q87   Outr sindr c/malform cong q acomet mult sist;2;1;3;-;6;2;-;8;-;3;1;3;5;1;-;6;13;2;12;22;10;6;8;-;-;2;3;119
Q89   Outr malformacoes congen NCOP;7;1;21;3;39;2;3;32;24;45;18;23;38;19;5;76;85;12;66;108;41;17;22;2;11;19;13;752
Q90   Sindr de Down;2;1;6;1;8;1;1;4;4;8;1;4;16;3;3;10;14;4;19;39;9;5;6;-;3;2;1;175
Q91   Sindr de Edwards e sindr de Patau;-;1;3;-;2;-;3;7;3;17;3;6;19;-;3;22;60;9;38;90;38;18;26;4;4;9;11;396
Q92   Outr trissomias e trissom parc autoss NCOP;-;-;-;-;-;-;-;-;-;-;-;-;-;-;-;1;-;1;1;2;-;-;-;-;-;-;-;5
Q93   Monossomias e delecoes dos autossomos NCOP;-;-;-;-;-;-;-;-;-;-;-;-;-;-;1;1;1;-;-;1;1;1;1;-;-;-;-;7
Q96   Sindr de Turner;-;-;-;-;1;-;-;1;-;-;1;-;-;-;-;-;-;-;-;-;-;-;1;-;-;-;-;4
Q98   Outr anom cromoss sexuais fenotipo masc NCOP;-;-;-;-;-;-;-;-;-;-;-;-;-;-;-;-;-;-;-;-;2;-;-;-;-;-;1;3
Q99   Outr anomalias dos cromossomos NCOP;-;-;2;-;-;-;-;1;2;3;-;-;4;-;-;4;12;1;4;20;6;1;-;2;3;1;2;68
R04   Hemorragia das vias respirat;-;-;-;-;-;-;-;-;-;-;-;-;-;-;-;1;-;-;-;-;-;-;-;-;-;-;-;1
R06   Anormalidades da respiracao;-;-;1;-;-;-;-;1;-;-;-;-;-;-;-;-;-;-;-;-;-;-;-;-;-;-;1;3
R09   Outr sint sinais relat ap circulat respirat;3;-;-;1;5;-;-;7;-;1;-;2;-;-;-;1;4;1;-;4;-;2;3;1;1;3;-;39
R10   Dor abdominal e pelvica;-;-;-;-;-;-;-;1;-;-;-;-;-;-;-;1;-;-;-;1;-;-;-;-;-;-;-;3
R11   Nausea e vomitos;-;-;-;-;-;-;-;-;-;-;-;-;-;-;-;-;-;-;-;-;-;-;1;-;-;-;-;1
R14   Flatulencia e afeccoes correlatas;-;-;-;-;-;-;-;-;-;-;-;1;-;-;-;-;-;-;-;-;-;-;-;-;-;-;-;1
R16   Hepatomegalia e esplenomegalia NCOP;-;-;-;-;-;-;-;-;-;1;-;-;-;-;-;-;-;-;-;-;-;-;-;-;-;-;-;1
R17   Ictericia NE;-;-;-;-;1;-;-;-;-;-;-;-;-;-;-;2;-;-;-;-;-;-;-;-;-;-;-;3
R40   Sonolencia estupor e coma;-;-;-;-;-;-;-;-;1;-;-;-;-;-;-;1;-;-;-;-;-;-;-;-;-;-;-;2
R50   Febre origem desconhecida e outras origens;-;-;-;-;-;-;-;1;-;-;-;-;-;-;-;-;-;-;-;1;-;-;-;-;-;-;-;2
R56   Convulsoes NCOP;-;-;1;-;-;1;-;1;-;1;-;-;-;-;2;1;-;-;-;-;-;-;-;-;-;-;1;8
R57   Choque NCOP;-;-;-;-;1;-;-;3;-;-;-;1;-;1;-;-;2;-;2;3;-;1;-;-;1;1;-;16
R60   Edema NCOP;-;-;-;-;-;-;-;-;-;-;-;-;-;-;-;-;-;-;-;-;-;-;-;1;-;1;-;2
R63   Sint sinais relat ingestao alimentos liquid;-;-;-;-;-;-;-;-;-;1;-;-;-;-;-;-;-;-;-;-;-;-;-;-;-;-;-;1
R64   Caquexia;-;-;-;-;-;-;-;1;-;-;-;-;-;-;-;-;-;-;-;-;-;-;-;-;-;-;-;1
R68   Outr sint e sinais gerais;-;-;-;-;1;1;-;1;1;-;1;-;-;-;1;1;-;-;1;-;1;1;-;-;-;1;-;11
R95   Sindr da morte subita na infancia;6;-;6;1;4;-;3;12;4;16;-;2;7;1;-;12;26;4;3;28;7;7;7;3;3;7;1;170
R96   Outr mortes subitas de causa desconhecida;-;-;-;-;1;1;-;-;-;-;-;-;-;1;-;1;3;-;-;3;-;1;-;-;1;1;-;13
R98   Morte s/assist;3;-;14;-;16;-;-;5;8;1;-;3;3;2;-;22;12;-;-;6;3;1;-;-;-;-;-;99
R99   Outr causas mal definidas e NE mortalidade;6;-;37;4;13;4;2;16;7;8;4;6;4;6;6;65;80;2;51;104;15;10;27;5;11;16;5;514
V03   Pedestre traum colis automov pickup caminhon;-;-;-;1;-;-;-;-;-;-;-;-;-;-;-;-;-;-;-;-;-;-;-;1;-;1;-;3
V09   Pedestre traum outr acid transp e NE;-;-;-;-;-;-;-;1;-;-;1;-;-;-;-;1;-;-;1;-;-;-;-;-;-;-;-;4
V23   Motocicl traum colis automov pickup caminhon;-;-;-;-;1;-;-;1;-;-;-;-;-;-;-;-;-;-;-;-;-;-;-;-;-;-;-;2
V28   Motociclista traum acid transp s/colis;-;-;-;-;-;1;-;-;-;-;-;-;-;-;-;-;-;-;-;-;-;-;-;-;-;-;-;1
V29   Motociclista traum outr acid transp e NE;-;-;-;-;-;-;-;-;-;-;-;-;-;-;-;-;-;-;1;-;-;-;-;-;-;-;-;1
V43   Ocup automov traum col auto pickup caminhon;1;-;-;-;-;-;-;-;-;-;-;-;1;-;-;-;1;-;1;4;2;-;2;1;1;-;1;15
V44   Ocup autom traum colis veic trans pesad onib;-;-;-;-;-;-;-;-;-;-;-;-;-;1;-;-;-;-;-;1;2;1;2;-;-;1;-;8
V46   Ocup automov traum colis outr veic n-motor;-;-;-;-;-;-;-;-;-;-;-;-;-;-;-;-;-;-;-;-;-;-;1;-;-;-;-;1
V47   Ocup automovel traum colis obj fixo parado;1;-;-;-;-;-;-;-;-;-;-;-;-;-;-;-;-;-;-;1;-;1;-;-;-;2;1;6
V48   Ocup automovel traum acid transp s/colis;1;-;-;-;-;1;-;-;-;-;-;-;-;-;-;1;-;-;-;1;5;-;1;-;1;1;1;13
V49   Ocup automovel traum outr acid transp e NE;1;-;-;-;1;-;-;-;1;1;-;-;1;-;-;3;4;-;1;5;-;-;1;-;-;-;-;19
V59   Ocup caminhonete traum outr acid transp NE;-;-;-;-;-;-;-;-;-;-;-;-;-;-;-;-;1;-;-;-;-;-;-;-;-;-;-;1
V63   Ocup veic tr pesado traum col auto caminhon;-;-;-;-;-;-;-;-;-;-;-;-;-;-;-;-;-;-;-;-;-;-;1;-;-;-;-;1
V78   Ocup onibus traum acid transp s/colis;-;-;-;-;-;-;-;-;-;-;-;-;-;-;-;-;-;-;-;2;-;-;-;-;-;-;-;2
V87   Acid trans tipo espec desconh mod transp vit;-;-;-;-;-;-;-;-;-;1;-;-;-;-;-;-;-;-;-;-;-;-;-;-;-;-;-;1
V89   Acid veic mot n-mot tipos de veic NE;-;-;-;-;-;-;-;1;-;-;-;-;-;-;-;2;4;-;1;3;1;-;-;-;1;1;-;14
V99   Acid transp NE;-;-;-;-;-;-;-;-;-;1;-;-;-;-;-;1;-;-;-;-;-;-;-;-;-;-;-;2
W01   Queda mesmo nivel escorr tropec passo falso;-;1;-;-;1;-;-;-;-;-;-;-;-;-;-;-;1;-;-;-;-;-;-;-;-;-;-;3
W04   Queda enquanto carreg apoiado p/outr pessoas;-;-;-;-;-;-;-;-;-;1;-;-;1;-;-;1;-;-;1;-;-;-;-;-;-;-;-;4
W06   Queda de um leito;-;-;1;-;-;-;1;1;-;-;-;-;1;1;-;-;-;1;3;2;1;-;1;-;-;1;-;14
W08   Queda de outr tipo de mobilia;-;-;1;-;-;-;-;-;-;-;-;-;-;-;-;-;-;1;1;1;-;-;-;-;-;-;-;4
W10   Queda em ou de escadas ou degraus;-;-;-;-;-;-;-;-;-;-;1;-;-;-;-;-;1;-;2;2;-;-;-;-;-;-;-;6
W13   Queda de ou p/fora edificios outr estruturas;-;-;-;-;-;-;-;-;-;-;-;-;-;-;-;-;-;-;-;-;1;-;-;-;-;-;-;1
W18   Outr quedas no mesmo nivel;-;-;-;-;-;-;-;-;-;-;-;-;-;1;-;2;1;-;-;-;-;-;-;-;-;-;-;4
W19   Queda s/especificacao;-;-;1;-;-;-;-;-;-;1;-;-;-;-;-;-;1;-;2;-;-;-;1;-;-;-;-;6
W20   Impacto caus objeto lanc projetado em queda;-;-;1;-;-;-;-;-;-;-;-;-;-;-;-;-;1;-;-;-;-;-;-;-;-;-;-;2
W22   Impacto acid ativo passivo caus outr objetos;-;-;-;-;-;-;-;-;-;-;-;-;-;-;-;1;1;-;-;-;-;-;-;-;-;-;-;2
W23   Apert colhid comprim esmag dentro objetos;-;-;-;-;-;-;-;-;-;-;-;-;-;-;-;-;-;-;-;-;1;-;-;-;-;-;-;1
W27   Contato c/ferramentas manuais s/motor;-;-;-;-;-;-;-;-;-;-;-;-;-;1;-;-;-;-;-;-;-;-;-;-;-;-;-;1
W34   Projeteis de outr armas de fogo e das NE;-;-;-;-;-;-;-;-;-;-;-;-;-;-;-;-;1;-;-;-;-;-;-;-;-;-;-;1
W39   Queima de fogos de artificio;-;-;-;-;-;-;-;-;-;-;-;-;-;-;-;1;-;-;1;-;-;-;-;-;-;-;-;2
W50   Golpe panc pontape mord escor infl outr pess;-;-;-;-;-;-;-;-;-;-;-;-;-;-;-;-;-;-;-;-;-;-;1;-;-;-;-;1
W54   Mordedura ou golpe provocado p/cao;-;-;-;-;-;-;-;-;-;-;-;-;-;-;-;-;-;-;-;1;-;-;-;-;-;-;-;1
W64   Exposicao outr forcas mecan animadas e as NE;-;-;-;-;-;-;-;-;-;-;-;-;-;-;-;-;-;-;-;-;-;-;-;1;-;-;-;1
W65   Afogamento submersao durante banho banheira;-;-;-;-;-;-;-;-;-;-;-;-;-;-;-;-;-;-;-;-;-;-;1;-;-;-;-;1
W66   Afogamento submersao consec queda banheira;-;-;-;-;1;-;-;-;-;-;-;-;-;-;-;-;-;-;-;-;-;-;-;-;-;-;-;1
W67   Afogamento e submersao em piscina;-;-;-;-;-;-;-;-;-;-;-;-;-;-;-;-;-;-;-;2;-;-;-;-;-;1;-;3
W68   Afogamento submersao conseq queda piscina;-;-;-;-;-;-;-;-;-;-;-;-;-;-;-;-;-;1;-;-;-;-;-;-;-;-;-;1
W69   Afogamento e submersao em aguas naturais;-;-;-;-;-;1;-;-;-;-;-;-;1;-;-;-;-;-;-;1;-;-;-;-;1;-;1;5
W70   Afogamento submersao conseq queda aguas nat;-;-;1;-;3;-;-;-;-;-;-;-;-;-;-;-;-;-;-;-;-;-;-;-;-;-;-;4
W73   Outr afogamentos e submersao espec;1;-;1;-;-;-;-;-;-;-;-;-;-;1;-;-;-;-;-;-;-;-;-;-;-;-;1;4
W74   Afogamento e submersao NE;1;-;2;-;1;1;-;-;-;-;-;-;-;-;-;1;-;-;2;-;-;-;2;-;1;1;-;12
W75   Sufocacao e estrangulamento acid na cama;-;-;1;-;1;-;2;2;1;1;-;-;-;-;-;1;2;1;3;7;3;2;5;2;-;3;-;37
W76   Outr enforcamento e estrangulamento acid;-;-;-;-;-;-;-;-;-;1;-;-;-;-;-;-;-;-;-;-;-;-;-;-;-;-;-;1
W77   Risco resp dev desmor queda terra outr subst;-;-;-;-;-;-;-;-;-;-;-;-;-;3;-;-;-;-;-;-;-;-;-;-;-;-;-;3
W78   Inalacao do conteudo gastrico;-;-;3;-;3;1;3;4;-;4;2;9;28;-;-;2;8;6;25;36;42;8;14;3;6;7;4;218
W79   Inalacao ingest aliment caus obstr trat resp;2;-;4;5;6;1;-;5;1;1;1;1;7;1;-;5;10;4;12;33;2;-;18;11;2;2;-;134
W80   Inalac ingest outr obj caus obstr trat resp;-;1;1;-;-;1;-;-;-;-;-;-;-;-;-;2;1;-;1;4;-;-;1;1;-;-;-;13
W83   Outr riscos espec a respiracao;-;-;-;-;-;-;-;-;-;-;-;-;-;-;-;-;-;-;-;1;-;-;1;-;-;1;-;3
W84   Riscos NE a respiracao;-;2;2;1;2;-;-;1;2;2;2;2;2;1;2;9;4;4;58;64;3;-;5;3;1;-;-;172
W87   Exposicao a corrente eletrica NE;-;-;-;-;-;1;-;3;1;1;1;1;2;2;-;-;-;-;1;1;-;-;-;-;-;1;-;15
W89   Expos fontes lumin artif visiv luz ultraviol;-;-;-;-;-;-;-;-;-;-;-;-;-;-;1;-;-;-;-;-;-;-;-;-;-;-;-;1
X00   Expos fogo n-contr edificio outr tipo constr;-;-;-;-;-;-;-;-;-;-;-;-;-;-;-;-;-;-;-;1;-;-;-;-;-;-;-;1
X06   Exposicao combustao outr tipo roupa acessor;-;-;-;-;-;-;-;-;-;-;-;-;-;1;-;-;-;-;-;-;-;-;-;-;-;-;-;1
X09   Exposicao a tipo NE de fumaca fogo chamas;-;-;1;-;-;1;-;-;-;-;1;-;-;1;-;-;-;-;1;-;-;1;-;1;-;-;-;7
X12   Contato c/outr liquidos quentes;-;-;1;-;-;-;-;-;-;-;-;-;-;-;-;-;-;-;-;1;-;-;-;-;-;-;-;2
X20   Contato c/serpentes e lagartos venenosos;-;-;-;-;-;-;-;-;1;-;-;-;-;-;-;-;-;-;-;-;-;-;-;-;-;-;-;1
X23   Contato c/abelhas vespas e vespoes;-;-;-;-;1;-;-;-;-;-;-;-;-;-;-;-;-;-;-;-;-;-;-;-;-;-;-;1
X40   Envenen acid analg antipir anti-reum n-opiac;-;-;-;-;-;-;-;-;-;-;-;-;-;-;-;-;-;-;-;-;-;-;-;-;-;-;1;1
X44   Envenen acid outr drog medic subst biolog NE;-;-;-;-;-;-;-;-;-;-;-;-;-;-;-;-;1;-;-;-;-;-;-;-;-;-;-;1
X49   Envenen acid outr subst quim nocivas e as NE;-;-;-;-;-;-;-;-;-;-;-;-;-;-;-;-;1;-;-;-;-;-;-;-;-;-;-;1
X59   Exposicao a fatores NE;-;-;-;-;-;-;-;-;-;-;-;-;-;-;-;2;-;-;-;3;-;-;-;-;-;2;-;7
X86   Agressao p/meio de subst corrosivas;1;-;-;-;-;-;-;-;-;-;-;-;-;-;-;-;-;-;-;-;-;-;-;-;-;-;-;1
X91   Agressao enforc estrangulamento sufocacao;-;1;-;-;-;-;-;1;-;-;-;-;1;-;-;1;-;-;-;1;1;1;2;1;-;-;1;11
X92   Agressao p/meio de afogamento e submersao;-;-;-;-;-;-;-;-;-;1;-;-;-;-;-;-;1;-;-;2;-;-;-;-;-;1;-;5
X95   Agressao disparo outr arma de fogo ou NE;-;-;-;-;3;-;-;1;-;1;-;-;-;-;-;-;-;-;1;-;-;-;-;-;-;-;-;6
X97   Agressao p/meio de fumaca fogo e chamas;-;-;-;-;-;-;-;-;-;-;-;-;-;-;-;-;-;-;-;-;-;-;1;-;-;-;-;1
X99   Agressao objeto cortante ou penetrante;-;-;3;-;-;-;-;-;-;-;-;-;-;-;-;1;-;-;1;2;-;-;-;-;-;-;-;7
Y00   Agressao p/meio de um objeto contundente;-;-;-;1;2;-;1;-;-;-;-;-;-;-;-;-;1;-;-;2;1;-;-;-;-;2;-;10
Y01   Agressao p/meio projecao de um lugar elevado;-;-;-;-;-;-;-;-;-;-;-;-;-;-;-;-;-;-;1;-;-;1;-;-;-;-;-;2
Y04   Agressao p/meio de forca corporal;-;-;-;-;-;-;-;-;-;-;-;-;-;-;1;-;-;-;1;-;1;-;1;-;-;-;-;4
Y06   Negligencia e abandono;-;-;-;-;-;1;-;-;-;-;-;-;-;-;-;-;1;1;2;-;-;-;-;-;1;-;-;6
Y07   Outr sindr de maus tratos;-;-;-;-;-;1;-;-;-;1;-;-;-;-;-;-;-;1;-;1;-;2;-;1;-;1;1;9
Y08   Agressao p/outr meios espec;-;-;-;-;-;-;-;-;-;-;-;-;-;-;-;-;1;-;-;-;-;-;-;-;-;-;-;1
Y09   Agressao p/meios NE;1;-;20;12;-;-;-;-;-;-;-;-;-;1;-;1;-;-;-;-;1;-;-;-;-;-;-;36
Y13   Env out subst farm sist nerv auton int n det;-;-;-;-;-;-;-;-;-;-;-;-;-;-;-;-;-;-;-;-;-;-;1;-;-;-;-;1
Y20   Enforc estrang sufoc intenc nao determinada;-;-;1;-;-;-;-;1;2;-;1;1;-;1;-;1;2;-;3;6;1;-;2;-;2;2;-;26
Y21   Afogamento submersao intenc nao determinada;-;-;-;-;-;-;-;-;-;-;-;-;1;-;-;-;-;-;-;-;-;-;-;-;-;-;-;1
Y29   Contato obj contundente intenc n det;-;-;-;-;-;-;-;-;-;1;-;-;-;-;-;3;-;-;-;2;-;-;-;-;-;-;-;6
Y30   Queda salto empurr lugar elev intenc n det;-;-;-;-;-;-;-;-;-;-;-;-;-;-;-;-;-;-;-;-;-;-;1;-;-;-;-;1
Y33   Outr fatos ou eventos espec intenc n det;-;-;1;-;-;-;-;-;-;-;-;-;1;-;-;1;-;-;-;1;-;-;1;-;-;-;-;5
Y34   Fatos ou eventos NE e intenc nao determinada;-;-;-;3;-;-;-;-;-;5;-;-;6;-;-;7;12;1;1;8;-;1;2;-;2;2;1;51
Y35   Intervencao legal;-;-;-;-;-;1;-;-;-;-;-;-;-;-;-;-;-;-;-;1;-;-;-;-;-;-;-;2
Y45   Subst analges antipiret e antiinflamatorias;-;-;-;-;-;-;-;-;-;-;-;-;-;-;1;-;-;-;-;-;-;-;-;-;-;-;-;1
Y48   Anestesicos e gases terapeuticos;-;-;-;-;-;-;-;-;-;-;-;-;-;-;-;-;-;-;-;1;-;-;-;-;-;-;-;1
Y58   Vacinas bacter;-;-;-;-;1;-;-;-;-;-;-;-;-;-;-;-;-;-;-;-;-;-;-;1;-;-;-;2
Y83   Reac anorm compl tard interv cirurg s/acid;-;-;-;-;-;-;-;1;-;-;1;-;1;1;-;5;2;-;3;2;-;-;1;-;-;1;-;18
Y84   Reac anorm compl tard out proc med s/acid;-;-;-;-;-;-;-;-;-;-;-;-;-;-;-;-;1;-;-;2;-;-;-;-;-;-;-;3
Total;353;223;1292;210;2136;302;309;1787;757;1688;569;764;1648;675;521;3081;2982;596;2770;6680;1633;976;1425;473;720;1159;494;36223